restaurant_id,category_menuitem,name_menuitem,description,price,id,position,name_restaurant,score,ratings,category_restaurant,price_range,full_address,zip_code,lat,lng
216,Entrees,opor ayam,"chicken slowly simmered in yellow curry sauce and herb, serve with yellow rice
",16.95 USD,216,10,Shiki Thai Sushi Restaurant,4.8,100.0,"Asian, Asian Cuisine, Family Friendly",$$,"3000 19th St S, Homewood, AL, 35209",35209,33.4783634,-86.7894193
342,Nori Specialties,Ayam Penyet,Marinated beef rice bow.,15.95 USD,342,15,Nori (4704 Cahaba River Rd),4.8,82.0,"Thai, Asian, Noodles",$,"4704 Cahaba River Rd, Vestavia, AL, 35243",35243,33.43225,-86.73778
342,Nori Specialties,Ikan Balado,Smashed fried spring chicken with hot chili sauce.,29.95 USD,342,15,Nori (4704 Cahaba River Rd),4.8,82.0,"Thai, Asian, Noodles",$,"4704 Cahaba River Rd, Vestavia, AL, 35243",35243,33.43225,-86.73778
342,Nori Specialties,Sate Kambing,,19.95 USD,342,15,Nori (4704 Cahaba River Rd),4.8,82.0,"Thai, Asian, Noodles",$,"4704 Cahaba River Rd, Vestavia, AL, 35243",35243,33.43225,-86.73778
1974,Indonesian Entrees,Curry,"Hot and spicy. Chicken breast with cabbage, onions, green, and red peppers.",12.6 USD,1974,170,Peking Chef Inc,,,"Chinese: Other, Noodles",,"8673 North Port Washington Road, Fox Point, WI, 53217",53217,43.17373,-87.91269
1974,Indonesian Entrees,Lamb Curry with Potatoes,Hot and spicy.,19.14 USD,1974,170,Peking Chef Inc,,,"Chinese: Other, Noodles",,"8673 North Port Washington Road, Fox Point, WI, 53217",53217,43.17373,-87.91269
1974,Indonesian Entrees,Rendang Beef,Hot and spicy. Thick curry with potatoes.,16.74 USD,1974,170,Peking Chef Inc,,,"Chinese: Other, Noodles",,"8673 North Port Washington Road, Fox Point, WI, 53217",53217,43.17373,-87.91269
1974,Indonesian Entrees,Sambal Udang,"Hot and spicy. Shrimp, green beans, onions, bamboo shoots, peppers, tofu, and tempeh.",15.9 USD,1974,170,Peking Chef Inc,,,"Chinese: Other, Noodles",,"8673 North Port Washington Road, Fox Point, WI, 53217",53217,43.17373,-87.91269
1974,Indonesian Entrees,Bali,"Hot and spicy. Fried beef, pea pods, bamboo shoots, onions, tomatoes, green and red pepper, carrots, and cashew nuts.",15.54 USD,1974,170,Peking Chef Inc,,,"Chinese: Other, Noodles",,"8673 North Port Washington Road, Fox Point, WI, 53217",53217,43.17373,-87.91269
1974,Indonesian Entrees,Ayam Goreng Mentega,Butter-dipped fried chicken with sweet Indonesian soy sauce.,16.74 USD,1974,170,Peking Chef Inc,,,"Chinese: Other, Noodles",,"8673 North Port Washington Road, Fox Point, WI, 53217",53217,43.17373,-87.91269
1974,Indonesian Entrees,Hot Plate,"Chicken with pea pods, green and red pepper, onions, and scallions.",15.0 USD,1974,170,Peking Chef Inc,,,"Chinese: Other, Noodles",,"8673 North Port Washington Road, Fox Point, WI, 53217",53217,43.17373,-87.91269
1974,Indonesian Entrees,Tom and Jerry Hot Plate,Shrimp and scallops.,17.94 USD,1974,170,Peking Chef Inc,,,"Chinese: Other, Noodles",,"8673 North Port Washington Road, Fox Point, WI, 53217",53217,43.17373,-87.91269
1974,Indonesian Entrees,Singapore Rice Noodles,"Hot and spicy. Shrimp, chicken, and curry.",12.6 USD,1974,170,Peking Chef Inc,,,"Chinese: Other, Noodles",,"8673 North Port Washington Road, Fox Point, WI, 53217",53217,43.17373,-87.91269
1974,Indonesian Entrees,Nasi Goreng,"Indonesian fried rice with shrimp, beef, chicken, and fried eggs.",14.4 USD,1974,170,Peking Chef Inc,,,"Chinese: Other, Noodles",,"8673 North Port Washington Road, Fox Point, WI, 53217",53217,43.17373,-87.91269
1974,Indonesian Entrees,Kweetiau Goreng,"Thick rice noodles, shrimp, beef, Chinese sausage, and eggs.",12.6 USD,1974,170,Peking Chef Inc,,,"Chinese: Other, Noodles",,"8673 North Port Washington Road, Fox Point, WI, 53217",53217,43.17373,-87.91269
1974,Indonesian Entrees,Biehun Goreng,Thin rice noodles.,12.6 USD,1974,170,Peking Chef Inc,,,"Chinese: Other, Noodles",,"8673 North Port Washington Road, Fox Point, WI, 53217",53217,43.17373,-87.91269
1974,Indonesian Entrees,Indonesian Kung Pao Shrimp,Hot and spicy.,17.4 USD,1974,170,Peking Chef Inc,,,"Chinese: Other, Noodles",,"8673 North Port Washington Road, Fox Point, WI, 53217",53217,43.17373,-87.91269
1974,Indonesian Entrees,Gado-Gado,Hot and spicy. Indonesian vegetarian delight with peanut sauce.,11.4 USD,1974,170,Peking Chef Inc,,,"Chinese: Other, Noodles",,"8673 North Port Washington Road, Fox Point, WI, 53217",53217,43.17373,-87.91269
1974,Indonesian Entrees,3 Delight Curry,"Hot and spicy. Shrimp, beef, and chicken.",17.4 USD,1974,170,Peking Chef Inc,,,"Chinese: Other, Noodles",,"8673 North Port Washington Road, Fox Point, WI, 53217",53217,43.17373,-87.91269
1974,Indonesian Entrees,Laksa with Chicken,Hot and spicy. Indonesian red curry soup with coconut milk.,12.6 USD,1974,170,Peking Chef Inc,,,"Chinese: Other, Noodles",,"8673 North Port Washington Road, Fox Point, WI, 53217",53217,43.17373,-87.91269
2144,Fresh Gourmet Sandwiches,#6 Tempeh Avocado,"Smoky tempeh, vegan cheddar, avocado, tomato, romaine, southwest vegenaise served on your choice of white, multigrain or dark rye bread",9.95 USD,2144,143,The Green Kitchen,4.7,23.0,"Sandwiches, American, Healthy",,"400 N Water St, Milwaukee, WI, 53202",53202,43.03524,-87.9081
2144,Hot Grilled Sandwiches,#15 Smoky Vegan Tempeh,"Smoky tempeh, avocado, spinach, red onion, tomato, vegenaise, served grilled on ciabatta",10.95 USD,2144,143,The Green Kitchen,4.7,23.0,"Sandwiches, American, Healthy",,"400 N Water St, Milwaukee, WI, 53202",53202,43.03524,-87.9081
2144,Wraps,Smoky Tempeh,"Smoky tempeh, avocado, tomato, romaine, red onion, southwest vegenaise, spinach tortilla",8.95 USD,2144,143,The Green Kitchen,4.7,23.0,"Sandwiches, American, Healthy",,"400 N Water St, Milwaukee, WI, 53202",53202,43.03524,-87.9081
4756,Picked for you,Tempeh Salad,"Grilled tempeh, our veggie mix, red onion, and tomatoes. Served on a bed of romaine lettuce.",8.25 USD,4756,82,Argus Bar &amp; Grill,,,"Burgers, American, Sandwiches",$$,"123 E Main St, Madison, WI, 53703",53703,43.07506,-89.38099
4756,Salads,Tempeh Salad,"Grilled tempeh, our veggie mix, red onion, and tomatoes. Served on a bed of romaine lettuce.",8.25 USD,4756,82,Argus Bar &amp; Grill,,,"Burgers, American, Sandwiches",$$,"123 E Main St, Madison, WI, 53703",53703,43.07506,-89.38099
6116,Appetizers,Teriyaki Tempeh Tacos,"Teriyaki garlic glazed tempeh, asian slaw, corn, and flour tortilla.",10.0 USD,6116,29,Avenue Eats,,,"Burgers, American, Sandwich",$$,"1201 Valley View Ave, Wheeling, WV, 26003",26003,40.07083,-80.685609
6971,Extras,Tempeh Bacon,,2.5 USD,6971,22,Good Natured Collective Market &amp; Cafe,,,"Healthy, Vegetarian, Salads",$$,"209 South Raleigh Street, Martinsburg, WV, 25401",25401,39.45678,-77.9693
8537,Picked for you,Nasi Goreng Indonesia,"Indonesian style fried rice served with crackers and choice of chicken, beef, pork, tofu, or shrimp. Consists of corn fritter, spicy egg, and stir fry vegetables.",14.5 USD,8537,66,Indo Cafe,4.8,47.0,"Asian, Indonesian",$,"13754 Aurora Ave N, Seattle, WA, 98133",98133,47.7301676,-122.3445066
8537,Picked for you,Rendang Sapi,Tender dry beef curry slow cooked in our traditional coconut sauce with eggs and crackers.,17.5 USD,8537,66,Indo Cafe,4.8,47.0,"Asian, Indonesian",$,"13754 Aurora Ave N, Seattle, WA, 98133",98133,47.7301676,-122.3445066
8537,Picked for you,Kwetiau Goreng Indonesia,Indonesian style stir fry wide rice noodle.,14.5 USD,8537,66,Indo Cafe,4.8,47.0,"Asian, Indonesian",$,"13754 Aurora Ave N, Seattle, WA, 98133",98133,47.7301676,-122.3445066
8537,Appetizers,Sate Ayam,"Grilled marinated chicken skewers, topped with peanut sauce and sweet soy sauce.",12.5 USD,8537,66,Indo Cafe,4.8,47.0,"Asian, Indonesian",$,"13754 Aurora Ave N, Seattle, WA, 98133",98133,47.7301676,-122.3445066
8537,Poultry and Meats,Ayam Goreng Mbok Berek,Javanese fried chicken topped with deep fried savory crumbs.,14.95 USD,8537,66,Indo Cafe,4.8,47.0,"Asian, Indonesian",$,"13754 Aurora Ave N, Seattle, WA, 98133",98133,47.7301676,-122.3445066
8537,Poultry and Meats,Ayam Cabe Ijo,Padangnese chicken with green chili sauce.,14.95 USD,8537,66,Indo Cafe,4.8,47.0,"Asian, Indonesian",$,"13754 Aurora Ave N, Seattle, WA, 98133",98133,47.7301676,-122.3445066
8537,Poultry and Meats,Ayam Goreng Balado,Fried chicken simmered in special spicy sauce.,14.95 USD,8537,66,Indo Cafe,4.8,47.0,"Asian, Indonesian",$,"13754 Aurora Ave N, Seattle, WA, 98133",98133,47.7301676,-122.3445066
8537,Poultry and Meats,Rendang Sapi,Tender dry beef curry slow cooked in our traditional coconut sauce with eggs and crackers.,17.5 USD,8537,66,Indo Cafe,4.8,47.0,"Asian, Indonesian",$,"13754 Aurora Ave N, Seattle, WA, 98133",98133,47.7301676,-122.3445066
8537,Poultry and Meats,Ayam Goreng Penyet,Crushed fried chicken served with rice and chili paste.,13.95 USD,8537,66,Indo Cafe,4.8,47.0,"Asian, Indonesian",$,"13754 Aurora Ave N, Seattle, WA, 98133",98133,47.7301676,-122.3445066
8537,Poultry and Meats,Ayam Bakar Kecap,Grilled chicken served with sweet BBQ sauce.,14.95 USD,8537,66,Indo Cafe,4.8,47.0,"Asian, Indonesian",$,"13754 Aurora Ave N, Seattle, WA, 98133",98133,47.7301676,-122.3445066
8537,Poultry and Meats,Ayam Bakar Manado,Manadonese spicy BBQ chicken.,14.95 USD,8537,66,Indo Cafe,4.8,47.0,"Asian, Indonesian",$,"13754 Aurora Ave N, Seattle, WA, 98133",98133,47.7301676,-122.3445066
8537,Mini Rijsttafel,MR Ayam Goreng Balado,Fried chicken topped with balado chili sauce.,16.5 USD,8537,66,Indo Cafe,4.8,47.0,"Asian, Indonesian",$,"13754 Aurora Ave N, Seattle, WA, 98133",98133,47.7301676,-122.3445066
8537,Mini Rijsttafel,MR Ayam Goreng Mbok Berek,Javanese fried chicken topped with deep fried savory crumbs.,16.5 USD,8537,66,Indo Cafe,4.8,47.0,"Asian, Indonesian",$,"13754 Aurora Ave N, Seattle, WA, 98133",98133,47.7301676,-122.3445066
8537,Mini Rijsttafel,MR Ayam Cabe Ijo,Padangnese chicken with green chili sauce.,16.5 USD,8537,66,Indo Cafe,4.8,47.0,"Asian, Indonesian",$,"13754 Aurora Ave N, Seattle, WA, 98133",98133,47.7301676,-122.3445066
8537,Mini Rijsttafel,MR Rendang Sapi,Tender dry beef curry slow-cooked in our traditional coconut sauce with eggs and crackers.,19.5 USD,8537,66,Indo Cafe,4.8,47.0,"Asian, Indonesian",$,"13754 Aurora Ave N, Seattle, WA, 98133",98133,47.7301676,-122.3445066
8537,Mini Rijsttafel,MR Ayam Bakar Kecap,Grilled chicken served with sweet BBQ sauce.,16.5 USD,8537,66,Indo Cafe,4.8,47.0,"Asian, Indonesian",$,"13754 Aurora Ave N, Seattle, WA, 98133",98133,47.7301676,-122.3445066
8537,Mini Rijsttafel,MR Ayam Bakar Manado,Manadonese spicy BBQ chicken.,16.5 USD,8537,66,Indo Cafe,4.8,47.0,"Asian, Indonesian",$,"13754 Aurora Ave N, Seattle, WA, 98133",98133,47.7301676,-122.3445066
8537,Noodles,Kwetiau Goreng Indonesia,Indonesian style stir fry wide rice noodle.,14.5 USD,8537,66,Indo Cafe,4.8,47.0,"Asian, Indonesian",$,"13754 Aurora Ave N, Seattle, WA, 98133",98133,47.7301676,-122.3445066
8537,Noodles,Bihun Goreng Indonesia,Indonesian style stir-fry fine rice noodle.,14.5 USD,8537,66,Indo Cafe,4.8,47.0,"Asian, Indonesian",$,"13754 Aurora Ave N, Seattle, WA, 98133",98133,47.7301676,-122.3445066
8537,Rice,Nasi Goreng Indonesia,"Indonesian style fried rice served with crackers and choice of chicken, beef, pork, tofu, or shrimp. Consists of corn fritter, spicy egg, and stir fry vegetables.",14.5 USD,8537,66,Indo Cafe,4.8,47.0,"Asian, Indonesian",$,"13754 Aurora Ave N, Seattle, WA, 98133",98133,47.7301676,-122.3445066
8561,Burgers &amp; Sandwiches,Grilled Tempeh Burger,"sauteed organic tempeh &amp; roasted red pepper sauce on a 7-grain bun or gluten-free cornbread, served with lettuce, tomato &amp; radish sprouts",13.95 USD,8561,40,Sunlight Cafe,4.9,60.0,"Vegetarian, Vegan, Healthy",$$,"6404 9th Ave NE, Seattle, WA, 98115",98115,47.6751518,-122.3175976
8561,Hot Entrees,Tempeh Taco Plate,"two corn tortillas filled with spiced sauteed organic tempeh, cheddar cheese, olives, tomatoes, lettuce, cilantro; beans and rice on the side, sour cream and salsa on the side (for vegan, select no dairy)",15.5 USD,8561,40,Sunlight Cafe,4.9,60.0,"Vegetarian, Vegan, Healthy",$$,"6404 9th Ave NE, Seattle, WA, 98115",98115,47.6751518,-122.3175976
8561,Sides,Organic Sauteed Tempeh,,6.5 USD,8561,40,Sunlight Cafe,4.9,60.0,"Vegetarian, Vegan, Healthy",$$,"6404 9th Ave NE, Seattle, WA, 98115",98115,47.6751518,-122.3175976
8574,"Lunch Menu  / Sandwiches, Burgers &amp; Subs",Tempeh Reuben,Fried tempeh strips topped with sauerkraut and a healthy smearing of cheddar cheese sauce and 1000 island dressing on grilled rye.,13.28 USD,8574,26,Wayward Vegan Cafe,4.9,200.0,"Vegetarian, Vegan, Healthy",$,"801 NE 65th St, Seattle, WA, 98115",98115,47.6757,-122.3198
8574,Starters &amp; Sides / Sides,Tempeh Bacon,,3.75 USD,8574,26,Wayward Vegan Cafe,4.9,200.0,"Vegetarian, Vegan, Healthy",$,"801 NE 65th St, Seattle, WA, 98115",98115,47.6757,-122.3198
8918,Mains,Ayam Kremes,Fried chicken topped with crispy crumbs.,10.0 USD,8918,2,Waroeng Jajanan,,,"Indonesian, Asian",$,"22315 WA-99, Edmonds, WA, 98026",98026,47.7966709,-122.3330707
8918,Mains,Ayam Penyet,Crushed fried chicken with chilli sauce.,10.0 USD,8918,2,Waroeng Jajanan,,,"Indonesian, Asian",$,"22315 WA-99, Edmonds, WA, 98026",98026,47.7966709,-122.3330707
8918,Mains,Ayam Cabe Hijau,Green chilli paste.,10.0 USD,8918,2,Waroeng Jajanan,,,"Indonesian, Asian",$,"22315 WA-99, Edmonds, WA, 98026",98026,47.7966709,-122.3330707
9396,Appetizers,Roti Telur,Also called murtabak an Indian style pancake stuffed with chopped onions and bell peppers. Served with curry dipping sauce.,9.5 USD,9396,42,Malay Satay Hut,4.6,43.0,"Malaysian, Asian, Asian Fusion",$,"15230 NE 24th St, Redmond, WA, 98052",98052,47.6317808,-122.1365997
9396,Seafood Specialties,Ikan Assam,,20.95 USD,9396,42,Malay Satay Hut,4.6,43.0,"Malaysian, Asian, Asian Fusion",$,"15230 NE 24th St, Redmond, WA, 98052",98052,47.6317808,-122.1365997
10100,More Ways to Yumm!,Tofu or Tempeh Yumm! Bento®,Organic Brown Rice or Thai Jasmine Rice served with our creamy ginger Asian Cole Slaw and a side of Yumm! Sauce.®,12.95 USD,10100,5,Cafe Yumm! (Mill Plain Crossing),4.8,73.0,"American, Sandwiches, Healthy, Burritos, Kids Friendly, Family Friendly, Family Meals, Mexican",$,"500 SE 192nd Ave Ste 400, Vancouver, WA, 98683",98683,45.618172,-122.476456
10100,Salad · Soup · Sides,Teriyaki Tempeh Skewer,Marinated organic tempeh skewer baked with teriyaki sauce. Topped with black sesame seeds.,5.0 USD,10100,5,Cafe Yumm! (Mill Plain Crossing),4.8,73.0,"American, Sandwiches, Healthy, Burritos, Kids Friendly, Family Friendly, Family Meals, Mexican",$,"500 SE 192nd Ave Ste 400, Vancouver, WA, 98683",98683,45.618172,-122.476456
10100,Extras,Side Tempeh,,5.0 USD,10100,5,Cafe Yumm! (Mill Plain Crossing),4.8,73.0,"American, Sandwiches, Healthy, Burritos, Kids Friendly, Family Friendly, Family Meals, Mexican",$,"500 SE 192nd Ave Ste 400, Vancouver, WA, 98683",98683,45.618172,-122.476456
10393,SIGNATURE  NOODLE / FRIED RICE,Indonesia Fried Rice*,"Fried rice with egg, onion, scallion topped with crispy chicken and fried egg in special fried rice sauce",17.95 USD,10393,195,Ka Pow Thai On Wheels,4.9,62.0,"Thai, Asian, Street Food",$,"5600 Delridge Way SW, Seattle, WA, 98106",98106,47.5516745,-122.3627492
10420,Chefs special,Kalderetang kambing,Ghost stew,18.87 USD,10420,146,Mekenie Pampangga's Special,4.8,28.0,"Breakfast and Brunch, South Asian, Filipino",$$,"16928 116th Ave SE, Renton, WA, 98058",98058,47.4506943,-122.1849037
10967,Salads,Tempting Tempeh BBQ,"*Limited time special! Cabbage, field greens, BBQ tempeh, potato chips, pickles, corn, red onion &amp; creamy slaw dressing",0.0 USD,10967,180,Crisp (3901 N. Williams),4.8,170.0,"Salads, Healthy, Vegetarian, Family Meals, Salads",$$,"3901 N Williams Ave, Portland, OR, 97227",97227,45.5509626,-122.6669962
11117,Small Plates,Tempeh 'Bacon' and Brussels Sprout Fried Rice (GF),"Savory Tempeh, Brussel Sprouts and Carrot Cabbage Slaw with Indian Spices",12.0 USD,11117,92,The Sudra Mississippi,4.7,23.0,"Indian, Vegetarian, Asian",$,"906 N Fremont St, Portland, OR, 97227",97227,45.54775,-122.6758
11117,Soup and Salad,SM Roasted Beet and Tempeh Salad (GF),"with Pickled Daikon Radish, Carrots and Red Cabbage Over Mixed Greens Tossed in Coconut Poppy Seed Dressing",9.6 USD,11117,92,The Sudra Mississippi,4.7,23.0,"Indian, Vegetarian, Asian",$,"906 N Fremont St, Portland, OR, 97227",97227,45.54775,-122.6758
11289,"Vegan, Veggie &amp; Meat",Chipotle Tempeh Burrito,"Served with spicy organic chipotle homemade tempeh, jalapenos, green bell peppers, grilled onions, rice, salsa Fresca, and chipotle aioli sauce on a flour tortilla.",9.0 USD,11289,203,El Nutri Taco,5.0,73.0,"Mexican, Vegan, Vegetarian",$,"2124 Ne Alberta St, Portland, OR, 97211",97211,45.55891,-122.64328
11395,Sides,Tempeh,,3.5 USD,11395,119,Cafe Gertrude,,,"American, Breakfast and Brunch, Comfort Food, Allergy Friendly",$,"3023 NE Alberta St, Portland, OR, 97211",97211,45.5591685,-122.634262
11395,Sides,Tempeh Bacon,,4.0 USD,11395,119,Cafe Gertrude,,,"American, Breakfast and Brunch, Comfort Food, Allergy Friendly",$,"3023 NE Alberta St, Portland, OR, 97211",97211,45.5591685,-122.634262
11445,Picked for you,Tandoori Tempeh Curry,"Locally made squirrel and crow chickpea and quinoa tempeh in a smokey coconut milk-based sauce. 

Plates served with Bengali 5-spice basmati rice, turmeric-mustard vinaigrette slaw, seasonal pickles, and spicy green chutney.  Low carb plate is served with double portion of slaw instead of rice. 

Rice Bowls served with just rice.",14.5 USD,11445,17,DesiPDX,4.9,49.0,"Indian, Gluten Free, Vegetarian, Allergy Friendly",,"4237 North Mississippi Avenue, Portland, OR, 97217",97217,45.55451,-122.67567
11445,Plates and Bowls,Tandoori Tempeh Curry,"Locally made squirrel and crow chickpea and quinoa tempeh in a smokey coconut milk-based sauce. 

Plates served with Bengali 5-spice basmati rice, turmeric-mustard vinaigrette slaw, seasonal pickles, and spicy green chutney.  Low carb plate is served with double portion of slaw instead of rice. 

Rice Bowls served with just rice.",14.5 USD,11445,17,DesiPDX,4.9,49.0,"Indian, Gluten Free, Vegetarian, Allergy Friendly",,"4237 North Mississippi Avenue, Portland, OR, 97217",97217,45.55451,-122.67567
11445,A-La-Carte,Side of Tandoori Tempeh Curry,,5.0 USD,11445,17,DesiPDX,4.9,49.0,"Indian, Gluten Free, Vegetarian, Allergy Friendly",,"4237 North Mississippi Avenue, Portland, OR, 97217",97217,45.55451,-122.67567
11477,Picked for you,Ayam Goreng,,15.5 USD,11477,42,Wajan,,,"Indonesian, South East Asian, Asian, Alcohol",$,"4611 E Burnside St, Portland, OR, 97215",97215,45.52323,-122.61529
11477,Cemilan,Sate Ayam,"three char-broiled chicken skewers with peanut sauce and acar (cucumber, carrot and chili relish)

Contains peanuts/ Tree nuts",8.75 USD,11477,42,Wajan,,,"Indonesian, South East Asian, Asian, Alcohol",$,"4611 E Burnside St, Portland, OR, 97215",97215,45.52323,-122.61529
11477,Makanan,Ayam Goreng,,15.5 USD,11477,42,Wajan,,,"Indonesian, South East Asian, Asian, Alcohol",$,"4611 E Burnside St, Portland, OR, 97215",97215,45.52323,-122.61529
11477,Makanan,Rendang Sapi,,20.0 USD,11477,42,Wajan,,,"Indonesian, South East Asian, Asian, Alcohol",$,"4611 E Burnside St, Portland, OR, 97215",97215,45.52323,-122.61529
11477,Tambahan,Tempe Orek,,6.0 USD,11477,42,Wajan,,,"Indonesian, South East Asian, Asian, Alcohol",$,"4611 E Burnside St, Portland, OR, 97215",97215,45.52323,-122.61529
11479,Signature Burgers and Such,Tempeh BBQ Burger,"Soy-free garbonzo tempeh, vegan garlic aioli, topped with our BBQ sauce and vegan cheese. Lettuce, tomato, onion and pickle on the side.",11.5 USD,11479,38,Dick's Primal Burger,4.7,144.0,"Burgers, American, Salads, Paleo, Vegetarian Friendly, Vegan Friendly, Alcohol",$,"4120 North Williams Avenue, Portland, OR, 97217",97217,45.55362,-122.6667
11609,Wraps,BBQ Tempeh Wrap Regular,"BBQed tempeh, carrot-cabbage-apple coleslaw, tomatoes, and greens with garlic aioli",12.0 USD,11609,100,Nectar Cafe (1925 Ne 42Nd Ave),4.8,52.0,"Vegetarian, Vegan, Healthy",$,"1925 Ne 42Nd Ave, Portland, OR, 97213",97213,45.5369,-122.62035
11836,Signature Burgers and Such,Tempeh BBQ Burger,"Soy-free garbonzo tempeh, vegan garlic aioli, topped with our BBQ sauce and vegan cheese. Lettuce, tomato, onion and pickle on the side.",11.5 USD,11836,229,Dick's Primal Burger,4.7,185.0,"Burgers, American, Sandwiches, Desserts, Paleo, Vegetarian Friendly, Vegan Friendly, Alcohol",$,"4905 Southeast Woodstock Boulevard, Portland, OR, 97206",97206,45.479417,-122.61203
11886,Entrées,Tempeh Burgers,"done two ways. A toasted ciabatta bun with a so-free lentil tempeh patty:
1) dude burger- grilled and caramelized sweet onion, bold nd rich steak sauce, horseradish ranch, creamy cashew cheese spread, lettuce, aroma tomatoes, and a pickle on top
2) daily fuel burger- creamy cashew cheese spread, avocado, red onions, mustard, lettuce, aroma tomatoes, and a pickle on top",9.0 USD,11886,269,Daily Fuel,,,"Vegetarian, Vegan, Healthy",$,"1080 SE Madison St, Portland, OR, 97214",97214,45.5128,-122.65502
11925,RICE BOWLS,TEMPEH BOWL,"MARINATED TEMPEH W/ SCALLIONS, CUCUMBERS, SHAVED CARROT, KOREAN BBQ SAUCE, SERVED
OVER RICE",8.5 USD,11925,181,High Water Mark Lounge &amp; Cafe,,,"Burgers, American, Sandwiches",$,"6800 NE M L King Blvd, Portland, OR, 97211",97211,45.57192,-122.66118
12007,Vegan &amp; Vegetarian,Tempeh Taco,"Diced tempeh seared with peppers and onions, lightly tossed with chipotle sauce. Served on a corn tortilla with shredded lettuce and guacamole.",3.5 USD,12007,300,Nayar Taqueria (5919 SE Foster Rd),4.7,18.0,"Mexican, Tacos, Burritos",,"5919 SE Foster Rd, Portland, OR, 97206",97206,45.492462,-122.602013
12467,Rice Dishes,Stir Fried Indonesia,"Sauteed mixed vegetables and shitake mushrooms in special Indonesian soy sauce and rice wine. Seasoned with sesame oil, ginger, garlic, and Indonesian chili sauce. Severed with steam rice.",13.99 USD,12467,103,Le-Le Restaurant,4.6,111.0,"Thai, Vegetarian Friendly, Asian, Vietnamese",$,"1012 M.L.K. Jr Way, Tacoma, WA, 98405",98405,47.2527199,-122.45209
12510,Rice Dishes,Stir Fried Indonesia,"Sauteed mix vegetables, shiitake mushroom in special Indonesian soy sauce, and rice wine. Seasoned with sesame oil, ginger, garlic, and Indonesian chili sauce. Served with white rice.",13.0 USD,12510,57,Lele East &amp; West,4.7,32.0,"Seafood, Thai, Vegetarian Friendly, Asian, Vietnamese",$,"5015, Tacoma, WA, 98409",98409,47.2112,-122.4634868
12806,Picked for you,Grilled Tempe Rubin Sandwich ,"Blue Heron rye sourdough bread, pastrami style tempeh, provolone cheese, sauerkraut, soy-free vegenaise, vegan thousand island and stone ground mustard ",11.99 USD,12806,14,Rainbow Cloud Cafe,4.9,44.0,"Sandwiches, Vegan Friendly, Gluten Free Friendly, Allergy Friendly",,"2727 Westmoor Court Southwest, Suite 300, Olympia, WA, 98502",98502,47.03728,-122.93611
12806,Sandwiches,Grilled Tempe Rubin Sandwich ,"Blue Heron rye sourdough bread, pastrami style tempeh, provolone cheese, sauerkraut, soy-free vegenaise, vegan thousand island and stone ground mustard ",11.99 USD,12806,14,Rainbow Cloud Cafe,4.9,44.0,"Sandwiches, Vegan Friendly, Gluten Free Friendly, Allergy Friendly",,"2727 Westmoor Court Southwest, Suite 300, Olympia, WA, 98502",98502,47.03728,-122.93611
12915,Picked for you,Spicy Ayam Goreng,Malaysia style fried chicken wings,9.0 USD,12915,266,Ooink,4.8,56.0,"Asian, Asian Fusion, Japanese",$,"1416 Harvard Ave, Seattle, WA, 98122",98122,47.6138677,-122.3215851
12915,Mains,Spicy Ayam Goreng,Malaysia style fried chicken wings,9.0 USD,12915,266,Ooink,4.8,56.0,"Asian, Asian Fusion, Japanese",$,"1416 Harvard Ave, Seattle, WA, 98122",98122,47.6138677,-122.3215851
13203,Fried Noodles,Indonesian Rice Noodles  印尼炒米粉,Spicy,14.95 USD,13203,5,Zhen Kee Chinese Restaurant,4.5,187.0,"Chinese Food, Allergy Friendly, Family Friendly",$,"151 Sunset Blvd N, Renton, WA, 98057",98057,47.4846806,-122.1969963
13203,Fried Rice,Indonesia Fried Rice  印尼炒饭,Spicy,14.95 USD,13203,5,Zhen Kee Chinese Restaurant,4.5,187.0,"Chinese Food, Allergy Friendly, Family Friendly",$,"151 Sunset Blvd N, Renton, WA, 98057",98057,47.4846806,-122.1969963
13233,Top 12 Best Items Combo Deal  (Select a Side &amp; a Drink for Just $9.95 Extra) 12道風味套餐,R23. Indonesian Fried Rice,"It's spicy and containing chicken, shrimp &amp; sunny side up egg. 
香辣炒飯 - 含雞肉, 蝦仁, 太陽蛋, 微辣",18.95 USD,13233,142,Pacific Cafe,,,"Chinese, Asian, Cantonese",$$,"416 5th Ave S, Seattle, WA, 98104",98104,47.598718,-122.327491
13233,Rice Dishes Section 碟頭飯類,R23. Indonesian Fried Rice ,"It's spicy and containing chicken, shrimp and sunny side up egg. Highly recommended!
香辣炒飯 (微辣) (含雞絲, 蝦仁, 太陽蛋) - 推薦!",18.95 USD,13233,142,Pacific Cafe,,,"Chinese, Asian, Cantonese",$$,"416 5th Ave S, Seattle, WA, 98104",98104,47.598718,-122.327491
14109,Paninis and Wraps,Tempeh Peanut Wrap,"Baked seasoned tempeh, spinach, carrots, green onions, cabbage, and vegan peanut sauce. Comes with Kettle brand potato chips.",9.99 USD,14109,96,Main Market Co-op,,,"Deli, Salads, Healthy",$$,"44 W Main Ave, Spokane, WA, 99201",99201,47.6594072,-117.4127146
14137,Picked for you,Tempeh Peanut Wrap,"Vegan. Baked seasoned tempeh, spinach, carrots, green onions, cabbage, and vegan peanut sauce. 
",9.99 USD,14137,125,Main Market CO-OP Deli,,,"Sandwiches, American, Healthy",$,"44 W Main Ave, Spokane, WA, 99201",99201,47.6594072,-117.4127146
14137,Salads,Tempeh Buddha Bowl  ,"Brown rice, cabbage, coconut sweet potatoes, cucumber, sesame tempeh, carrot, cilantro, green onion, w/ Thai peanut sauce",9.49 USD,14137,125,Main Market CO-OP Deli,,,"Sandwiches, American, Healthy",$,"44 W Main Ave, Spokane, WA, 99201",99201,47.6594072,-117.4127146
